{"$schema": "http://json-schema.org/schema#", "type": "object", "properties": {"kind": {"type": "string"}, "etag": {"type": "string"}, "items": {"type": "array", "items": {"type": "object", "properties": {"kind": {"type": "string"}, "etag": {"type": "string"}, "id": {"type": "string"}, "snippet": {"type": "object", "properties": {"publishedAt": {"type": "string", "format": "date-time"}, "channelId": {"type": "string"}, "title": {"type": "string"}, "description": {"type": "string"}, "thumbnails": {"type": "object", "properties": {"default": {"type": "object", "properties": {"url": {"type": "string"}, "width": {"type": "integer"}, "height": {"type": "integer"}}, "required": ["height", "url", "width"]}, "medium": {"type": "object", "properties": {"url": {"type": "string"}, "width": {"type": "integer"}, "height": {"type": "integer"}}, "required": ["height", "url", "width"]}, "high": {"type": "object", "properties": {"url": {"type": "string"}, "width": {"type": "integer"}, "height": {"type": "integer"}}, "required": ["height", "url", "width"]}, "standard": {"type": "object", "properties": {"url": {"type": "string"}, "width": {"type": "integer"}, "height": {"type": "integer"}}, "required": ["height", "url", "width"]}, "maxres": {"type": "object", "properties": {"url": {"type": "string"}, "width": {"type": "integer"}, "height": {"type": "integer"}}, "required": ["height", "url", "width"]}, "fhd": {"type": "object", "properties": {"url": {"type": "string"}, "width": {"type": "integer"}, "height": {"type": "integer"}}, "required": ["height", "url", "width"]}, "qhd": {"type": "object", "properties": {"url": {"type": "string"}, "width": {"type": "integer"}, "height": {"type": "integer"}}, "required": ["height", "url", "width"]}, "uhd": {"type": "object", "properties": {"url": {"type": "string"}, "width": {"type": "integer"}, "height": {"type": "integer"}}, "required": ["height", "url", "width"]}}, "required": ["default", "high", "medium"]}, "channelTitle": {"type": "string"}, "categoryId": {"type": "string"}, "liveBroadcastContent": {"type": "string"}, "defaultLanguage": {"type": "string"}, "localized": {"type": "object", "properties": {"title": {"type": "string"}, "description": {"type": "string"}}, "required": ["description", "title"]}, "defaultAudioLanguage": {"type": "string"}, "tags": {"type": "array", "items": {"type": "string"}}}, "required": ["categoryId", "channelId", "channelTitle", "defaultLanguage", "description", "liveBroadcastContent", "localized", "publishedAt", "thumbnails", "title"]}, "contentDetails": {"type": "object", "properties": {"dimension": {"type": "string", "format": "duration"}, "definition": {"type": "string"}, "caption": {"type": "string"}, "licensedContent": {"type": "boolean"}, "contentRating": {"type": "object"}, "projection": {"type": "string"}, "duration": {"type": "string", "format": "duration"}, "regionRestriction": {"type": "object", "properties": {"allowed": {"type": "array", "items": {"type": "string"}}, "blocked": {"type": "array", "items": {"type": "string"}}}}}, "required": ["caption", "contentRating", "definition", "dimension", "licensedContent", "projection"]}, "status": {"type": "object", "properties": {"uploadStatus": {"type": "string"}, "privacyStatus": {"type": "string"}, "license": {"type": "string"}, "embeddable": {"type": "boolean"}, "publicStatsViewable": {"type": "boolean"}, "madeForKids": {"type": "boolean"}}, "required": ["embeddable", "license", "madeForKids", "privacyStatus", "publicStatsViewable", "uploadStatus"]}, "statistics": {"type": "object", "properties": {"viewCount": {"type": "string"}, "likeCount": {"type": "string"}, "favoriteCount": {"type": "string"}, "commentCount": {"type": "string"}}, "required": ["favoriteCount"]}, "player": {"type": "object", "properties": {"embedHtml": {"type": "string"}}, "required": ["embedHtml"]}, "topicDetails": {"type": "object", "properties": {"topicCategories": {"type": "array", "items": {"type": "string"}}}, "required": ["topicCategories"]}, "recordingDetails": {"type": "object", "properties": {"locationDescription": {"type": "string"}, "location": {"type": "object", "properties": {"latitude": {"type": "number"}, "longitude": {"type": "number"}, "altitude": {"type": "integer"}}, "required": ["altitude", "latitude", "longitude"]}, "recordingDate": {"type": "string", "format": "date-time"}}}, "liveStreamingDetails": {"type": "object", "properties": {"scheduledStartTime": {"type": "string", "format": "date-time"}, "activeLiveChatId": {"type": "string"}, "actualStartTime": {"type": "string", "format": "date-time"}, "actualEndTime": {"type": "string", "format": "date-time"}}}, "localizations": {"type": "object", "properties": {"en-US": {"type": "object", "properties": {"title": {"type": "string"}, "description": {"type": "string"}}, "required": ["description", "title"]}, "en": {"type": "object", "properties": {"title": {"type": "string"}, "description": {"type": "string"}}, "required": ["description", "title"]}, "und": {"type": "object", "properties": {"title": {"type": "string"}, "description": {"type": "string"}}, "required": ["description", "title"]}, "hi": {"type": "object", "properties": {"title": {"type": "string"}, "description": {"type": "string"}}, "required": ["description", "title"]}, "ko": {"type": "object", "properties": {"title": {"type": "string"}, "description": {"type": "string"}}, "required": ["description", "title"]}, "ta": {"type": "object", "properties": {"title": {"type": "string"}, "description": {"type": "string"}}, "required": ["description", "title"]}, "id": {"type": "object", "properties": {"title": {"type": "string"}, "description": {"type": "string"}}, "required": ["description", "title"]}, "pa": {"type": "object", "properties": {"title": {"type": "string"}, "description": {"type": "string"}}, "required": ["description", "title"]}, "es-US": {"type": "object", "properties": {"title": {"type": "string"}, "description": {"type": "string"}}, "required": ["description", "title"]}, "nl-NL": {"type": "object", "properties": {"title": {"type": "string"}, "description": {"type": "string"}}, "required": ["description"]}, "pl": {"type": "object", "properties": {"title": {"type": "string"}, "description": {"type": "string"}}, "required": ["description", "title"]}, "te": {"type": "object", "properties": {"description": {"type": "string"}, "title": {"type": "string"}}, "required": ["description"]}, "uk": {"type": "object", "properties": {"title": {"type": "string"}, "description": {"type": "string"}}, "required": ["description", "title"]}, "it": {"type": "object", "properties": {"title": {"type": "string"}, "description": {"type": "string"}}, "required": ["description", "title"]}, "iw": {"type": "object", "properties": {"title": {"type": "string"}, "description": {"type": "string"}}, "required": ["description", "title"]}, "ml": {"type": "object", "properties": {"title": {"type": "string"}, "description": {"type": "string"}}, "required": ["description", "title"]}, "fr-FR": {"type": "object", "properties": {"title": {"type": "string"}, "description": {"type": "string"}}, "required": ["description", "title"]}, "de-DE": {"type": "object", "properties": {"title": {"type": "string"}, "description": {"type": "string"}}, "required": ["description", "title"]}, "ru": {"type": "object", "properties": {"title": {"type": "string"}, "description": {"type": "string"}}, "required": ["description"]}, "bn": {"type": "object", "properties": {"title": {"type": "string"}, "description": {"type": "string"}}, "required": ["description", "title"]}, "pt-BR": {"type": "object", "properties": {"title": {"type": "string"}, "description": {"type": "string"}}, "required": ["description", "title"]}, "ja": {"type": "object", "properties": {"title": {"type": "string"}, "description": {"type": "string"}}, "required": ["description", "title"]}, "ar": {"type": "object", "properties": {"title": {"type": "string"}, "description": {"type": "string"}}, "required": ["description", "title"]}, "de": {"type": "object", "properties": {"title": {"type": "string"}, "description": {"type": "string"}}, "required": ["description", "title"]}, "en-GB": {"type": "object", "properties": {"title": {"type": "string"}, "description": {"type": "string"}}, "required": ["description", "title"]}}}, "paidProductPlacementDetails": {"type": "object", "properties": {"hasPaidProductPlacement": {"type": "boolean"}}, "required": ["hasPaidProductPlacement"]}}, "required": ["contentDetails", "etag", "id", "kind", "localizations", "paidProductPlacementDetails", "player", "recordingDetails", "snippet", "statistics", "status"]}}, "pageInfo": {"type": "object", "properties": {"totalResults": {"type": "integer"}, "resultsPerPage": {"type": "integer"}}, "required": ["resultsPerPage", "totalResults"]}}, "required": ["etag", "items", "kind", "pageInfo"]}
