{
  "kind": "youtube#videoListResponse",
  "etag": "qsRZtlmddd7oAnQBeUcuQpsgGB8",
  "items": [
    {
      "kind": "youtube#video",
      "etag": "8DFt7cdxjnFvR8cEJEvnfnKzncc",
      "id": "6JTFYuloLFM",
      "snippet": {
        "publishedAt": "2024-10-01T04:02:04Z",
        "channelId": "UCuVPpxrm2VAgpH3Ktln4HXg",
        "title": "The Tell Tale Tummy /  A Little Help",
        "description": "The Tell-Tale Tummy: Share breaks Grumpy’s Cloud Express invention and tries to hide that she did it. Feeling the guilt, Shares learns about her conscience as it tries to tell her something through her tummy. A Little Help:  Grumpy has too much to handle in preparation for the Rainbow Night celebration, but he won’t ask for help. When Grizzle needs help of his own, Grumpy’s is the first to offer the villain a hand—and THAT makes him take a look at his own situation",
        "thumbnails": {
          "default": {
            "url": "https://i.ytimg.com/vi/6JTFYuloLFM/default.jpg",
            "width": 120,
            "height": 90
          },
          "medium": {
            "url": "https://i.ytimg.com/vi/6JTFYuloLFM/mqdefault.jpg",
            "width": 320,
            "height": 180
          },
          "high": {
            "url": "https://i.ytimg.com/vi/6JTFYuloLFM/hqdefault.jpg",
            "width": 480,
            "height": 360
          },
          "standard": {
            "url": "https://i.ytimg.com/vi/6JTFYuloLFM/sddefault.jpg",
            "width": 640,
            "height": 480
          }
        },
        "channelTitle": "YouTube Movies",
        "categoryId": "43",
        "liveBroadcastContent": "none",
        "defaultLanguage": "und",
        "localized": {
          "title": "The Tell Tale Tummy /  A Little Help",
          "description": "The Tell-Tale Tummy: Share breaks Grumpy’s Cloud Express invention and tries to hide that she did it. Feeling the guilt, Shares learns about her conscience as it tries to tell her something through her tummy. A Little Help:  Grumpy has too much to handle in preparation for the Rainbow Night celebration, but he won’t ask for help. When Grizzle needs help of his own, Grumpy’s is the first to offer the villain a hand—and THAT makes him take a look at his own situation"
        },
        "defaultAudioLanguage": "en"
      },
      "contentDetails": {
        "duration": "PT21M17S",
        "dimension": "2d",
        "definition": "sd",
        "caption": "true",
        "licensedContent": true,
        "regionRestriction": {
          "allowed": [
            "US"
          ]
        },
        "contentRating": {},
        "projection": "rectangular"
      },
      "status": {
        "uploadStatus": "processed",
        "privacyStatus": "public",
        "license": "youtube",
        "embeddable": true,
        "publicStatsViewable": true,
        "madeForKids": true
      },
      "statistics": {
        "likeCount": "1950",
        "favoriteCount": "0",
        "commentCount": "0"
      },
      "player": {
        "embedHtml": "\u003ciframe width=\"480\" height=\"360\" src=\"//www.youtube.com/embed/6JTFYuloLFM\" frameborder=\"0\" allow=\"accelerometer; autoplay; clipboard-write; encrypted-media; gyroscope; picture-in-picture; web-share\" referrerpolicy=\"strict-origin-when-cross-origin\" allowfullscreen\u003e\u003c/iframe\u003e"
      },
      "topicDetails": {
        "topicCategories": [
          "https://en.wikipedia.org/wiki/Entertainment",
          "https://en.wikipedia.org/wiki/Film",
          "https://en.wikipedia.org/wiki/Television_program"
        ]
      },
      "recordingDetails": {},
      "localizations": {
        "und": {
          "title": "The Tell Tale Tummy /  A Little Help",
          "description": "The Tell-Tale Tummy: Share breaks Grumpy’s Cloud Express invention and tries to hide that she did it. Feeling the guilt, Shares learns about her conscience as it tries to tell her something through her tummy. A Little Help:  Grumpy has too much to handle in preparation for the Rainbow Night celebration, but he won’t ask for help. When Grizzle needs help of his own, Grumpy’s is the first to offer the villain a hand—and THAT makes him take a look at his own situation"
        }
      },
      "paidProductPlacementDetails": {
        "hasPaidProductPlacement": false
      }
    }
  ],
  "pageInfo": {
    "totalResults": 1,
    "resultsPerPage": 1
  }
}
