{
  "kind": "youtube#videoListResponse",
  "etag": "h6XlFqpYXVyTGXooOsUmekAOPto",
  "items": [
    {
      "kind": "youtube#video",
      "etag": "UT3l_-nDethmeZVGXXWGU_WZuu4",
      "id": "zKQGAv8gtBA",
      "snippet": {
        "publishedAt": "2019-07-26T17:02:45Z",
        "channelId": "UCuVPpxrm2VAgpH3Ktln4HXg",
        "title": "Super Size Me",
        "description": "Winner at Sundance, director Morgan Spurlock's social experiment in fast-food gastronomy sees him attempting to subsist uniquely on food from the McDonald's menu for an entire month. In the process his weight balloons, his energy level plummets and he experiences all sorts of unexpected -- and terrifying -- side effects.",
        "thumbnails": {
          "default": {
            "url": "https://i.ytimg.com/vi/zKQGAv8gtBA/default.jpg",
            "width": 120,
            "height": 90
          },
          "medium": {
            "url": "https://i.ytimg.com/vi/zKQGAv8gtBA/mqdefault.jpg",
            "width": 320,
            "height": 180
          },
          "high": {
            "url": "https://i.ytimg.com/vi/zKQGAv8gtBA/hqdefault.jpg",
            "width": 480,
            "height": 360
          },
          "standard": {
            "url": "https://i.ytimg.com/vi/zKQGAv8gtBA/sddefault.jpg",
            "width": 640,
            "height": 480
          },
          "maxres": {
            "url": "https://i.ytimg.com/vi/zKQGAv8gtBA/maxresdefault.jpg",
            "width": 1280,
            "height": 720
          }
        },
        "channelTitle": "YouTube Movies",
        "categoryId": "30",
        "liveBroadcastContent": "none",
        "defaultLanguage": "en",
        "localized": {
          "title": "Super Size Me",
          "description": "Winner at Sundance, director Morgan Spurlock's social experiment in fast-food gastronomy sees him attempting to subsist uniquely on food from the McDonald's menu for an entire month. In the process his weight balloons, his energy level plummets and he experiences all sorts of unexpected -- and terrifying -- side effects."
        },
        "defaultAudioLanguage": "en"
      },
      "contentDetails": {
        "duration": "PT1H39M52S",
        "dimension": "2d",
        "definition": "hd",
        "caption": "true",
        "licensedContent": true,
        "regionRestriction": {
          "allowed": [
            "US"
          ]
        },
        "contentRating": {},
        "projection": "rectangular"
      },
      "status": {
        "uploadStatus": "processed",
        "privacyStatus": "public",
        "license": "youtube",
        "embeddable": true,
        "publicStatsViewable": true,
        "madeForKids": false
      },
      "statistics": {
        "likeCount": "114041",
        "favoriteCount": "0",
        "commentCount": "30107"
      },
      "player": {
        "embedHtml": "\u003ciframe width=\"480\" height=\"270\" src=\"//www.youtube.com/embed/zKQGAv8gtBA\" frameborder=\"0\" allow=\"accelerometer; autoplay; clipboard-write; encrypted-media; gyroscope; picture-in-picture; web-share\" referrerpolicy=\"strict-origin-when-cross-origin\" allowfullscreen\u003e\u003c/iframe\u003e"
      },
      "topicDetails": {
        "topicCategories": [
          "https://en.wikipedia.org/wiki/Entertainment",
          "https://en.wikipedia.org/wiki/Film",
          "https://en.wikipedia.org/wiki/Television_program"
        ]
      },
      "recordingDetails": {},
      "localizations": {
        "en": {
          "title": "Super Size Me",
          "description": "Winner at Sundance, director Morgan Spurlock's social experiment in fast-food gastronomy sees him attempting to subsist uniquely on food from the McDonald's menu for an entire month. In the process his weight balloons, his energy level plummets and he experiences all sorts of unexpected -- and terrifying -- side effects."
        }
      },
      "paidProductPlacementDetails": {
        "hasPaidProductPlacement": false
      }
    }
  ],
  "pageInfo": {
    "totalResults": 1,
    "resultsPerPage": 1
  }
}
