{
  "kind": "youtube#videoListResponse",
  "etag": "XYe8aoCh5igxxQr6K66B92TWnqM",
  "items": [
    {
      "kind": "youtube#video",
      "etag": "ic_aWMYWLM0qA7mIFclqT9cO8OY",
      "id": "g1eZjGhN8oo",
      "snippet": {
        "publishedAt": "2012-06-29T19:12:25Z",
        "channelId": "UCYoEbMFACdvkquYH5h31RNA",
        "title": "The Graduate",
        "description": "Nominated for 7 Academy Awards and Winner for Best Directing, this groundbreaking film classic launched the career of two-time Oscar Winner Dustin Hoffman. During a party given by his parents to celebrate his graduation, Benjamin Braddock (Hoffman) is seduced by the sexy Mrs. Robinson (Anne Bancroft), the wife of his father's business partner and closes friends. Although Benjamin is shy and inexperienced, they have an affair. But then, when Benjamin falls in love with Mrs. Robinson's daughter, Elaine (Katharine Ross), a jealous and angry Mrs. Robinson does everything in her power to keep the young couple apart.",
        "thumbnails": {
          "default": {
            "url": "https://i.ytimg.com/vi/g1eZjGhN8oo/default.jpg",
            "width": 120,
            "height": 90
          },
          "medium": {
            "url": "https://i.ytimg.com/vi/g1eZjGhN8oo/mqdefault.jpg",
            "width": 320,
            "height": 180
          },
          "high": {
            "url": "https://i.ytimg.com/vi/g1eZjGhN8oo/hqdefault.jpg",
            "width": 480,
            "height": 360
          },
          "standard": {
            "url": "https://i.ytimg.com/vi/g1eZjGhN8oo/sddefault.jpg",
            "width": 640,
            "height": 480
          },
          "maxres": {
            "url": "https://i.ytimg.com/vi/g1eZjGhN8oo/maxresdefault.jpg",
            "width": 1280,
            "height": 720
          }
        },
        "channelTitle": "YouTube Movies",
        "categoryId": "30",
        "liveBroadcastContent": "none",
        "defaultLanguage": "und",
        "localized": {
          "title": "The Graduate",
          "description": "Nominated for 7 Academy Awards and Winner for Best Directing, this groundbreaking film classic launched the career of two-time Oscar Winner Dustin Hoffman. During a party given by his parents to celebrate his graduation, Benjamin Braddock (Hoffman) is seduced by the sexy Mrs. Robinson (Anne Bancroft), the wife of his father's business partner and closes friends. Although Benjamin is shy and inexperienced, they have an affair. But then, when Benjamin falls in love with Mrs. Robinson's daughter, Elaine (Katharine Ross), a jealous and angry Mrs. Robinson does everything in her power to keep the young couple apart."
        },
        "defaultAudioLanguage": "en"
      },
      "contentDetails": {
        "duration": "PT1H45M58S",
        "dimension": "2d",
        "definition": "hd",
        "caption": "true",
        "licensedContent": true,
        "regionRestriction": {
          "allowed": [
            "US"
          ]
        },
        "contentRating": {},
        "projection": "rectangular"
      },
      "status": {
        "uploadStatus": "processed",
        "privacyStatus": "public",
        "license": "youtube",
        "embeddable": false,
        "publicStatsViewable": false,
        "madeForKids": false
      },
      "statistics": {
        "likeCount": "1512",
        "favoriteCount": "0",
        "commentCount": "0"
      },
      "player": {
        "embedHtml": "\u003ciframe width=\"480\" height=\"270\" src=\"//www.youtube.com/embed/g1eZjGhN8oo\" frameborder=\"0\" allow=\"accelerometer; autoplay; clipboard-write; encrypted-media; gyroscope; picture-in-picture; web-share\" referrerpolicy=\"strict-origin-when-cross-origin\" allowfullscreen\u003e\u003c/iframe\u003e"
      },
      "topicDetails": {
        "topicCategories": [
          "https://en.wikipedia.org/wiki/Entertainment",
          "https://en.wikipedia.org/wiki/Film"
        ]
      },
      "recordingDetails": {},
      "localizations": {
        "und": {
          "title": "The Graduate",
          "description": "Nominated for 7 Academy Awards and Winner for Best Directing, this groundbreaking film classic launched the career of two-time Oscar Winner Dustin Hoffman. During a party given by his parents to celebrate his graduation, Benjamin Braddock (Hoffman) is seduced by the sexy Mrs. Robinson (Anne Bancroft), the wife of his father's business partner and closes friends. Although Benjamin is shy and inexperienced, they have an affair. But then, when Benjamin falls in love with Mrs. Robinson's daughter, Elaine (Katharine Ross), a jealous and angry Mrs. Robinson does everything in her power to keep the young couple apart."
        }
      },
      "paidProductPlacementDetails": {
        "hasPaidProductPlacement": false
      }
    }
  ],
  "pageInfo": {
    "totalResults": 1,
    "resultsPerPage": 1
  }
}
